{
  "eventId": "019bd11a-33c8-7e07-b512-6a7b8c9d0e1f",
  "occurredAt": "2026-09-08T11:17:40.9060000+00:00",
  "aggregateId": "019bcf80-11a2-7c3d-8e45-0f9a1b2c3d4e",
  "organisationId": "019bcf7f-9d10-7b21-84c6-5e7f8a9b0c1d",
  "wasFirstRecorded": false,
  "eventType": "customers.preferences-changed.v1",
  "schemaVersion": 1
}
